Organization Name,Organization Name URL,Headquarters Location,Website,LinkedIn
Acentia,https://www.crunchbase.com/organization/acentia,"Falls Church, Virginia, United States",http://acentia.com,https://www.linkedin.com/company/acentia
The New York Public Library (NYPL),https://www.crunchbase.com/organization/new-york-public-library,"New York, New York, United States",http://www.nypl.org,https://www.linkedin.com/company/new-york-public-library?trk=top_nav_home
Barnabas Health,https://www.crunchbase.com/organization/barnabas-health,"West Orange, New Jersey, United States",http://www.barnabashealth.org,http://www.linkedin.com/company/barnabas-health
PerformTech,https://www.crunchbase.com/organization/performtech,"Alexandria, Virginia, United States",http://www.performtech.com,
Lincoln Center,https://www.crunchbase.com/organization/lincoln-center-for-the-performing-arts,"New York, New York, United States",http://www.lincolncenter.org/,
Pathlore,https://www.crunchbase.com/organization/pathlore,"Gainesville, Florida, United States",http://www.pathlore.com,https://www.linkedin.com/company/sumtotal-systems
gForce,https://www.crunchbase.com/organization/gforce-2,"San Jose, California, United States",http://www.gforcesystems.com,
Grand Rapids Public Schools,https://www.crunchbase.com/organization/grand-rapids-public-schools,"Grand Rapids, Michigan, United States",https://www.grps.org/,https://www.linkedin.com/company/grand-rapids-public-schools/
American Bible Society,https://www.crunchbase.com/organization/american-bible-society,"New York, New York, United States",http://www.americanbible.org/,
The Academic Advantage,https://www.crunchbase.com/organization/the-academic-advantage,"Los Angeles, California, United States",http://www.academicadvantage.com,http://www.linkedin.com/company/the-academic-advantage
ChildFund International,https://www.crunchbase.com/organization/childfund-international,"Richmond, Virginia, United States",http://www.childfund.org,http://www.linkedin.com/company/childfund-international
Children's Learning Adventure,https://www.crunchbase.com/organization/children-s-learning-adventure,"Phoenix, Arizona, United States",http://www.childrenslearningadventure.com,
Creme de la Creme,https://www.crunchbase.com/organization/creme-de-la-creme,"Greenwood Village, Colorado, United States",https://cremedelacreme.com/,https://www.linkedin.com/company/cr%C3%A8me-de-la-cr%C3%A8me-inc./
McElroy Manufacturing,https://www.crunchbase.com/organization/mcelroy-manufacturing,"Tulsa, Oklahoma, United States",http://www.mcelroy.com,
Education Sales Management,https://www.crunchbase.com/organization/education-sales-management,"Littleton, Colorado, United States",http://www.esm-sls.com,https://www.linkedin.com/company/esm_215559/
One Touch Direct,https://www.crunchbase.com/organization/one-touch-direct,"Tampa, Florida, United States",http://www.onetouchdirect.com,https://www.linkedin.com/company/one-touch-direct
Corvias Group,https://www.crunchbase.com/organization/corvias-group,"East Greenwich, Rhode Island, United States",http://www.corvias.com,https://www.linkedin.com/company/corvias-group
The Council on Foreign Relations,https://www.crunchbase.com/organization/council-on-foreign-relations,"New York, New York, United States",http://www.cfr.org,http://www.linkedin.com/company/council-on-foreign-relations
North Shore-LIJ Health System,https://www.crunchbase.com/organization/north-shore-lij-health-system,"Great Neck, New York, United States",http://northshorelij.com,https://www.linkedin.com/company/7968
My Learning Plan Inc.,https://www.crunchbase.com/organization/my-learning-plan-inc,"Malvern, Pennsylvania, United States","http://www.frontlinek12.com/News/Frontline_Technologies,_Leader_in_HR_Software_for_K-12_Education,_Acquires_My_Learning_Plan.html",https://www.linkedin.com/company/frontline-education
AdvoServ,https://www.crunchbase.com/organization/advoserv,"Bear, Delaware, United States",http://www.advoserv.com/,
Edify Schools,https://www.crunchbase.com/organization/edify-schools,"India, Pennsylvania, United States",https://www.edifyschools.com/,https://www.linkedin.com/company/mdn-edify-education
Wisconsin Manufacturers & Commerce,https://www.crunchbase.com/organization/wisconsin-manufacturers-commerce,"Madison, Wisconsin, United States",https://www.wmc.org/,
Linuxcare,https://www.crunchbase.com/organization/linuxcare,"San Francisco, California, United States",http://www.linuxcare.com,
Iris Global,https://www.crunchbase.com/organization/iris-global,"Redding, California, United States",http://www.irisglobal.org,http://www.linkedin.com/pub/christian-rodriguez-fornos/18/7a8/988/en
QuScient,https://www.crunchbase.com/organization/quscient,"Scottsdale, Arizona, United States",http://www.quscient.com,
Equitrac,https://www.crunchbase.com/organization/equitrac,"Fort Lauderdale, Florida, United States",http://www.equitrac.com,https://www.linkedin.com/company/nuance-document-imaging-solutions
Stanford Graduate School of Education,https://www.crunchbase.com/organization/stanford-graduate-school-of-education,"Stanford, California, United States",http://ed.stanford.edu/,
Spectrum Athletic Clubs,https://www.crunchbase.com/organization/spectrum-athletic-clubs,"El Segundo, California, United States",http://www.spectrumclubs.com/southbay,
Springstone,https://www.crunchbase.com/organization/springstone,"Westborough, Massachusetts, United States",https://secure.springstoneplan.com/,
Stride Ride,https://www.crunchbase.com/organization/stride-ride,"Lexington, Massachusetts, United States",http://www.striderite.com,https://www.linkedin.com/company/stride-rite
Knowledge Universe,https://www.crunchbase.com/organization/knowledge-universe,"Portland, Oregon, United States",http://www.knowledgeuniversecareers.com/,https://www.linkedin.com/company/kindercare
The United Federation of Teachers (UFT),https://www.crunchbase.com/organization/the-united-federation-of-teachers-uft,"Flushing, New York, United States",http://www.uft.org,
NOLS,https://www.crunchbase.com/organization/nols,"Lander, Wyoming, United States",https://www.nols.edu/,https://www.linkedin.com/school/nols/
Delta Career Education Corporation,https://www.crunchbase.com/organization/delta-career-education-corporation,"Virginia Beach, Virginia, United States",http://deltaed.com/,
BetterKnow,https://www.crunchbase.com/organization/betterknow,"Cupertino, California, United States",http://www.betterknow.com,
AEL Data,https://www.crunchbase.com/organization/ael-data,"Oregon City, Oregon, United States",http://www.aeldata.com,http://www.linkedin.com/company/ael-data
Northwestern Memorial Foundation,https://www.crunchbase.com/organization/northwestern-memorial-foundation,"Chicago, Illinois, United States",http://foundation.nmh.org/,https://www.linkedin.com/company/northwestern-memorial-hospital
Ward's Science,https://www.crunchbase.com/organization/ward-s-science,"Rochester, New York, United States",https://www.wardsci.com,https://www.linkedin.com/company/symantec
TetraData,https://www.crunchbase.com/organization/tetradata,"Greenville, South Carolina, United States",http://www.tetradata.com/,
Progressus Therapy,https://www.crunchbase.com/organization/progressus-therapy,"Tampa, Florida, United States",http://www.progressustherapy.com,https://www.linkedin.com/company/progressus-therapy
NCAR,https://www.crunchbase.com/organization/ncar,"Boulder, Colorado, United States",http://ncar.ucar.edu/,https://www.linkedin.com/company/national-center-for-atmospheric-research?trk=mini-profile
La Jolla Institute for Allergy & Immunology,https://www.crunchbase.com/organization/la-jolla-institute-for-allergy-immunology,"La Jolla, California, United States",http://www.lji.org,https://www.linkedin.com/company/la-jolla-institute-for-allergy-and-immunology
Startup Exchange,https://www.crunchbase.com/organization/startup-exchange,"Atlanta, Georgia, United States",http://www.startupexchange.gatech.edu/,
Innovation Center Denmark,https://www.crunchbase.com/organization/innovation-center-denmark,"Palo Alto, California, United States",http://icdk.um.dk,http://www.linkedin.com/company/innovation-center-denmark
Pinnacle Campus Living,https://www.crunchbase.com/organization/pinnacle-campus-living,"Addison, Texas, United States",http://www.pinnaclecampusliving.com/,https://www.linkedin.com/company/pinnacle-campus-living/
American Institute For Foreign Study,https://www.crunchbase.com/organization/american-institute-for-foreign-study,"Stamford, Connecticut, United States",http://aifs.com,
GTSoft,https://www.crunchbase.com/organization/gtsoft,"Sugar Land, Texas, United States",http://www.gtsoftusa.com,
Visant Holding,https://www.crunchbase.com/organization/visant-holding,"Armonk, New York, United States",http://www.visant.net/,
National Institute for Civil Discourse,https://www.crunchbase.com/organization/national-institute-for-civil-discourse,"Tucson, Arizona, United States",http://nicd.arizona.edu/,
Crossland Construction Company,https://www.crunchbase.com/organization/crossland-construction-company,"Columbus, Kansas, United States",http://www.crossland.com,http://www.linkedin.com/company/269771
Princeton University Investment Company,https://www.crunchbase.com/organization/princeton-university-investment-company,"Princeton, New Jersey, United States",http://princo.princeton.edu,
MIT Enterprise Forum of Cambridge,https://www.crunchbase.com/organization/mit-enterprise-forum-of-cambridge,"Cambridge, Massachusetts, United States",http://www.mitforumcambridge.org/,http://www.linkedin.com/company/mit-enterprise-forum-of-cambridg
Andrew Wommack Ministries,https://www.crunchbase.com/organization/andrew-wommack-ministries,"Colorado Springs, Colorado, United States",http://www.awmi.net/,https://www.linkedin.com/company/awmi/
Arizona Board of Regents,https://www.crunchbase.com/organization/arizona-board-of-regents,"Phoenix, Arizona, United States",https://www.azregents.edu/,
Flad Architects,https://www.crunchbase.com/organization/flad-architects,"Madison, Wisconsin, United States",http://www.flad.com/,
Sheppard Enoch Pratt Hospital,https://www.crunchbase.com/organization/sheppard-enoch-pratt-hospital,"Baltimore, Maryland, United States",https://www.sheppardpratt.org,
TG,https://www.crunchbase.com/organization/tg,"Round Rock, Texas, United States",http://www.tgslc.org/,https://www.linkedin.com/company/tg
Arizona Attorney General,https://www.crunchbase.com/organization/arizona-attorney-general,"Phoenix, Arizona, United States",https://www.azag.gov,https://www.linkedin.com/company/arizona-attorney-general's-office
Nolij Corporation,https://www.crunchbase.com/organization/nolij-corporation,"Beverly, Massachusetts, United States",https://www.nolij.com,https://www.linkedin.com/company/nolij-corporation
Zoni Language Centers,https://www.crunchbase.com/organization/zoni-language-centers,"New York, New York, United States",http://www.zoni.com,
National Academy of Engineering,https://www.crunchbase.com/organization/national-academy-of-engineering,"Washington, District of Columbia, United States",https://www.nae.edu,http://www.linkedin.com/companies/the-national-academies
MIT OpenCourseware,https://www.crunchbase.com/organization/mit-opencourseware,"Cambridge, Massachusetts, United States",http://ocw.mit.edu/index.htm,
Johnson Publishing Company,https://www.crunchbase.com/organization/johnson-publishing-company,"Chicago, Illinois, United States",http://www.johnsonpublishing.com,https://in.linkedin.com/company/johnson-publishing-company
Element K,https://www.crunchbase.com/organization/element-k,"Rochester, New York, United States",http://www.elementk.com/,
The Entrepreneurs Source,https://www.crunchbase.com/organization/the-entrepreneurs-source,"Southbury, Connecticut, United States",http://www.theentrepreneurssource.com,http://www.linkedin.com/company/12868
The International Computer Science Institute (ICSI),https://www.crunchbase.com/organization/the-international-computer-science-institute-icsi,"Berkeley, California, United States",http://www.icsi.berkeley.edu/icsi,
Children's Hospital of Alabama,https://www.crunchbase.com/organization/children-s-hospital-of-alabama,"Birmingham, Alabama, United States",https://www.childrensal.org,
All Children's Hospital,https://www.crunchbase.com/organization/all-children-s-hospital,"Saint Petersburg, Florida, United States",http://www.allkids.org/,https://www.linkedin.com/company/all-children's-hospital
EleMental Learning Tutoring,https://www.crunchbase.com/organization/elemental-learning-tutoring,"Naperville, Illinois, United States",http://www.elemental-learning.com,http://www.linkedin.com/company/elemental-learning-llc
Critical Instruction,https://www.crunchbase.com/organization/critical-instruction,"New York, New York, United States",https://criticalinstruction.com/,
LSA Global,https://www.crunchbase.com/organization/lsa-global,"Redwood City, California, United States",http://lsaglobal.com/,
City of Mesa,https://www.crunchbase.com/organization/city-of-mesa,"Mesa, Arizona, United States",http://www.mesaaz.gov/,https://www.linkedin.com/company/city-of-mesa/
OMICS Group Inc.,https://www.crunchbase.com/organization/omics-group-inc,"Burlingame, California, United States",http://www.omicsgroup.com/lasers-optics-photonics-conference-2014/index.php,http://www.linkedin.com/company/OMICS-PUBLISHING-GROUP
The Georgia BioBusiness Center,https://www.crunchbase.com/organization/the-georgia-biobusiness-center-llc,"Athens, Georgia, United States",http://www.ovpr.uga.edu/gbbc,
CORE Education Consulting and Solutions,https://www.crunchbase.com/organization/core-education-consulting-and-solutions,"Princeton, New Jersey, United States",http://www.coreecs.com,
Resource Development Company,https://www.crunchbase.com/organization/resource-development-company,"Birmingham, Michigan, United States",http://resourcedev.com/,https://www.linkedin.com/company/resource-development-company
FCS eLearning Solutions,https://www.crunchbase.com/organization/fcs-elearning-solutions,"California City, California, United States",http://www.fcslearningsolutions.com,https://www.linkedin.com/company/fcs-learning-solutions
MetSchools,https://www.crunchbase.com/organization/metschools,"New York, New York, United States",http://www.metschools.com,https://www.linkedin.com/company-beta/2158460
The Legatum Center,https://www.crunchbase.com/organization/the-legatum-center,"Cambridge, Massachusetts, United States",https://legatum.mit.edu,
Jewish Family & Childrens Service,https://www.crunchbase.com/organization/jewish-family-childrens-service,"Waltham, Massachusetts, United States",http://www.jfcsboston.org/,
Texas A&M Engineering Extension Service,https://www.crunchbase.com/organization/texas-a-m-engineering-extension-service,"College Station, Texas, United States",https://teex.org,https://www.linkedin.com/company-beta/813447
The Klingon Language Institute,https://www.crunchbase.com/organization/the-klingon-language-institute,"Blue Bell, Pennsylvania, United States",http://kli.org/,
Telamon Corporation,https://www.crunchbase.com/organization/telamon-corporation,"Raleigh, North Carolina, United States",http://www.telamon.org/,https://www.linkedin.com/company/telamon-corporation/
HSM Americas,https://www.crunchbase.com/organization/hsm-americas,"Downingtown, Pennsylvania, United States",https://www.hsm.us,https://www.linkedin.com/company/hsm-of-america
The Carter Centers Board of Counselors,https://www.crunchbase.com/organization/the-carter-center-s-board-of-counselors,"Atlanta, Georgia, United States",http://www.cartercenter.org/about/councilors/index.html,https://www.linkedin.com/company/the-carter-center
Seattle Public Library,https://www.crunchbase.com/organization/seattle-public-library,"Seattle, Washington, United States",https://www.spl.org/,
Enterprise Recovery Systems,https://www.crunchbase.com/organization/enterprise-recovery-systems,"Oak Brook, Illinois, United States",http://ersinc.com,https://www.linkedin.com/company/10867252
CfBT Education Trust,https://www.crunchbase.com/organization/cfbt-education-trust,"Berkshire, New York, United States",https://www.cfbt.com/,https://www.linkedin.com/company/cfbt
Signature Worldwide,https://www.crunchbase.com/organization/signature-worldwide,"Dublin, Ohio, United States",http://www.signatureworldwide.com,https://www.linkedin.com/company/signature-worldwide
The Childrens Hospital Research Institute,https://www.crunchbase.com/organization/the-childrens-hospital-research-institute,"Milwaukee, Wisconsin, United States",http://www.chw.org,
MIT Press,https://www.crunchbase.com/organization/mit-press,"Cambridge, Massachusetts, United States",https://mitpress.mit.edu/,
Institute for Child and Family Health,https://www.crunchbase.com/organization/institute-for-child-and-family-health,"Miami, Florida, United States",http://www.icfhinc.org,
ALMA International,https://www.crunchbase.com/organization/alma-international,"Maricopa, Arizona, United States",http://www.almainternational.org/,https://www.linkedin.com/company/alma-international/
caHUB,https://www.crunchbase.com/organization/cahub,"Bethesda, Maryland, United States",https://biospecimens.cancer.gov,
CIAN,https://www.crunchbase.com/organization/cian,"Tucson, Arizona, United States",http://cian-erc.org/,
"CoMotion, University of Washington",https://www.crunchbase.com/organization/university-of-washington-c4c,"Seattle, Washington, United States",http://comotion.uw.edu,https://www.linkedin.com/company/university-of-washington-center-for-commercialization
Mt. Everest Academy,https://www.crunchbase.com/organization/mt-everest-academy,"San Diego, California, United States",http://www.sandi.net/mteverest,
Institute of International Education,https://www.crunchbase.com/organization/institute-of-international-education,"New York, New York, United States",http://iie.org/en/,https://www.linkedin.com/company/institute-of-international-education
UW-Platteville,https://www.crunchbase.com/organization/uw-platteville,"Platteville, Wisconsin, United States",https://www.uwplatt.edu,
Adviza,https://www.crunchbase.com/organization/adviza,"Berkshire, New York, United States",http://www.adviza.org.uk/,http://www.linkedin.com/company/adviza-partnership?trk=top_nav_home
Becker Friedman Institute,https://www.crunchbase.com/organization/becker-friedman-institute,"Chicago, Illinois, United States",https://bfi.uchicago.edu,
Children's Aid Society,https://www.crunchbase.com/organization/children-s-aid-society,"Madison, Alabama, United States",http://www.childrensaid.org/,
"Bard Graduate Center: Decorative Arts, Design History, Material Culture",https://www.crunchbase.com/organization/bard-graduate-center--decorative-arts--design-history--material-culture,"New York, New York, United States",http://bgc.bard.edu,https://www.linkedin.com/company/2982379
Trans Com Systems,https://www.crunchbase.com/organization/trans-com-systems,"Spokane, Washington, United States",http://www.trans-system.com,https://www.linkedin.com/company/trans-system-inc-
eCampus Tutors,https://www.crunchbase.com/organization/ecampus-tutors,"Corvallis, Oregon, United States",http://ecampus.oregonstate.edu,https://www.linkedin.com/company/oregon-state-ecampus
ISTS,https://www.crunchbase.com/organization/ists,"Hanover, New Hampshire, United States",http://www.ists.dartmouth.edu/,
Next Generation Children's Centers,https://www.crunchbase.com/organization/next-generation-children-s-centers,"Sudbury, Massachusetts, United States",http://www.ngccenters.com/,
District of Columbia Public Schools,https://www.crunchbase.com/organization/district-of-columbia-public-schools,"Washington, District of Columbia, United States",http://dcps.dc.gov/,
NTL,https://www.crunchbase.com/organization/ntl,"Washington, District of Columbia, United States",http://www.ntl.org,https://www.linkedin.com/company/ntl-institute
Emory Wheel,https://www.crunchbase.com/organization/emory-wheel,"Atlanta, Georgia, United States",http://www.emorywheel.com/,
Citizen Schools,https://www.crunchbase.com/organization/citizen-schools,"Boston, Massachusetts, United States",http://www.citizenschools.org/,https://www.linkedin.com/company/163061
Cyber-Socio Intelligent Systems (CySIS) Lab,https://www.crunchbase.com/organization/cyber-socio-intelligent-systems-cysis-lab,"Tempe, Arizona, United States",http://lab.engineering.asu.edu/cysis/,
Academic-Writing.Org,https://www.crunchbase.com/organization/academic-writing-org-2,"Seattle, Washington, United States",http://academic-writing.org/,
IDEA.org,https://www.crunchbase.com/organization/idea-org,"Rockville, Maryland, United States",http://www.idea.org/,
Leona Group,https://www.crunchbase.com/organization/leona-group,"Phoenix, Arizona, United States",http://www.leonagroup.com/,https://www.linkedin.com/company/leona-group-llc/
NYC Department of Education,https://www.crunchbase.com/organization/nyc-department-of-education,"New York, New York, United States",http://schools.nyc.gov/careers,
John Wayne Cancer Institute,https://www.crunchbase.com/organization/john-wayne-cancer-institute,"Santa Monica, California, United States",http://newstjohns.org/John_Wayne_Cancer_Institute/,
Kellogg Insight,https://www.crunchbase.com/organization/kellogg-insight,"Evanston, Illinois, United States",,
RADIL,https://www.crunchbase.com/organization/radil,"Columbia, Missouri, United States",http://www.radil.missouri.edu,
cocoon library,https://www.crunchbase.com/organization/cocoon-library,"Forest Hill, Maryland, United States",http://cocoon.apache.org,
Shorenstein Center,https://www.crunchbase.com/organization/shorenstein-center,"Cambridge, Massachusetts, United States",http://shorensteincenter.org/,
eBusiness Technologies,https://www.crunchbase.com/organization/ebusiness-technologies,"Pittsburgh, Pennsylvania, United States",http://www.ebusiness.cs.cmu.edu,
EEOC,https://www.crunchbase.com/organization/eeoc,"Washington, District of Columbia, United States",http://eeoc.gov,http://www.linkedin.com/company/eeoc
eReader,https://www.crunchbase.com/organization/ereader,"San Jose, California, United States",http://eReader.com,
CoStart,https://www.crunchbase.com/organization/costart,"Columbus, Ohio, United States",http://costart.osu.edu/,
NECC,https://www.crunchbase.com/organization/necc-2,"Southborough, Massachusetts, United States",http://www.necc.org,http://www.linkedin.com/company/the-new-england-center-for-child
University of Nebraska Press,https://www.crunchbase.com/organization/university-of-nebraska-press,"Lincoln, Nebraska, United States",http://www.nebraskapress.unl.edu,
Beatitudes Campus,https://www.crunchbase.com/organization/beatitudes-campus,"Phoenix, Arizona, United States",http://www.beatitudescampus.org,http://www.linkedin.com/company/1126457
Ufunded,https://www.crunchbase.com/organization/ufunded,"Columbus, Ohio, United States",http://www.ufunded.com,
Beckman Institute,https://www.crunchbase.com/organization/beckman-institute,"Urbana, Illinois, United States",http://beckman.illinois.edu/,
Conner Prairie,https://www.crunchbase.com/organization/conner-prairie,"Fishers, Indiana, United States",http://www.connerprairie.org,https://www.linkedin.com/company/conner-prairie
CMEINFO.com,https://www.crunchbase.com/organization/cmeinfo-com,"Birmingham, Alabama, United States",http://www.cmeinfo.com/,https://www.linkedin.com/company/a.d.a.m.-inc.
Fung Institute for Engineering Leadership,https://www.crunchbase.com/organization/fung-institute-for-engineering-leadership,"Berkeley, California, United States",http://www.funginstitute.berkeley.edu/,http://www.linkedin.com/company/uc-berkeley-fung-institue-for-engineering-leadership
HowardCenter,https://www.crunchbase.com/organization/howardcenter,"Burlington, Vermont, United States",http://www.howardcenter.org/home,
Medical Effectiveness Research Center for Diverse Populations,https://www.crunchbase.com/organization/medical-effectiveness-research-center-for-diverse-populations,"San Francisco, California, United States",http://dgim.ucsf.edu/diversity/,
UCSF Helen Diller Family Comprehensive Cancer Center,https://www.crunchbase.com/organization/ucsf-helen-diller-family-comprehensive-cancer-center,"San Francisco, California, United States",http://cancer.ucsf.edu/,
Ozbox,https://www.crunchbase.com/organization/ozbox,"New York, New York, United States",http://www.oup.com.au,
Carnegie Mellon's Entertainment Technology Center,https://www.crunchbase.com/organization/carnegie-mellons-entertainment-technology-center,"Pittsburgh, Pennsylvania, United States",http://www.etc.cmu.edu,
BDW,https://www.crunchbase.com/organization/bdw,"Boulder, Colorado, United States",http://bdw.colorado.edu/,
Sunnyvale Public Library,https://www.crunchbase.com/organization/sunnyvale-public-library,"Sunnyvale, California, United States",http://sunnyvale.ca.gov/Departments/SunnyvalePublicLibrary.aspx,http://www.linkedin.com/company/city-of-sunnyvale
Semester Online,https://www.crunchbase.com/organization/semester-online,"Hyattsville, Maryland, United States",http://www.semesteronline.org,
Engagement Lab,https://www.crunchbase.com/organization/engagement-lab,"Boston, Massachusetts, United States",http://elab.emerson.edu/,
Business Association of Stanford Entrepreneurial Students,https://www.crunchbase.com/organization/business-association-of-stanford-entrepreneurial-students,"Stanford, California, United States",http://bases.stanford.edu/,
EdLab,https://www.crunchbase.com/organization/edlab,"New York, New York, United States",http://edlab.tc.columbia.edu,
Innovative Computing Laboratory,https://www.crunchbase.com/organization/innovative-computing-laboratory,"Knoxville, Tennessee, United States",http://www.icl.utk.edu/,
Campus Outreach,https://www.crunchbase.com/organization/campus-outreach,"Birmingham, Alabama, United States",http://campusoutreach.org,
