Organization Name,Organization Name URL,Headquarters Location,Website,LinkedIn
Princeton Review,https://www.crunchbase.com/organization/princeton-review,"Framingham, Massachusetts, United States",http://www.princetonreview.com,http://www.linkedin.com/company/the-princeton-review
Internships.com,https://www.crunchbase.com/organization/internships,"Burbank, California, United States",http://www.internships.com,
National Academy of Sciences,https://www.crunchbase.com/organization/national-academy-of-sciences,"Washington, District of Columbia, United States",http://nasonline.org,https://www.linkedin.com/company/national-academy-of-sciences
LRN,https://www.crunchbase.com/organization/lrn,"New York, New York, United States",http://www.lrn.com/,http://www.linkedin.com/company/lrn
California Arts Council,https://www.crunchbase.com/organization/california-arts-council,"Sacramento, California, United States",http://arts.ca.gov/index.php,
Simbionix,https://www.crunchbase.com/organization/simbionix,"Cleveland, Ohio, United States",http://simbionix.com,http://www.linkedin.com/company/35459
eParachute,https://www.crunchbase.com/organization/eparachute,"San Francisco, California, United States",https://eparachute.com/,
Skyward,https://www.crunchbase.com/organization/skyward-2,"Stevens Point, Wisconsin, United States",https://www.skyward.com/,https://www.linkedin.com/company/61181/
Apollo Education Group,https://www.crunchbase.com/organization/apollo-education-group,"Phoenix, Arizona, United States",http://www.apollo.edu/,http://www.linkedin.com/company/apollo-group
Talisma,https://www.crunchbase.com/organization/talisma,"Boca Raton, Florida, United States",http://www.talisma.com,
Pole To Win,https://www.crunchbase.com/organization/pole-to-win,"Larkspur, California, United States",https://www.ptw.com,https://www.linkedin.com/company/ptwintl
Mathnasium,https://www.crunchbase.com/organization/mathnasium,"Los Angeles, California, United States",https://www.mathnasium.com/,https://www.linkedin.com/company/mathnasium--the-math-learning-center/about/
KnowledgeHut,https://www.crunchbase.com/organization/connaissanceshut-training-and-consulting-pvt-ltd-knowledgehut,"Wilmington, Delaware, United States",http://www.knowledgehut.com,http://www.linkedin.com/company/connaissanceshut-training-
WorldStrides,https://www.crunchbase.com/organization/worldstrides,"Charlottesville, Virginia, United States",https://worldstrides.com,
"Gilbane, Inc",https://www.crunchbase.com/organization/gilbane-inc,"Providence, Rhode Island, United States",https://www.gilbaneco.com/inc/,https://www.linkedin.com/company/gilbane-inc.
The Learning Company,https://www.crunchbase.com/organization/the-learning-company,"Boston, Massachusetts, United States",http://www.learningcompany.com/,http://www.linkedin.com/company/3980
Americans for Prosperity,https://www.crunchbase.com/organization/americans-for-prosperity,"Arlington, Virginia, United States",http://americansforprosperity.org,https://www.linkedin.com/company/americans-for-prosperity
Scantron,https://www.crunchbase.com/organization/scantron,"Eagan, Minnesota, United States",http://www.scantron.com,https://www.linkedin.com/company/14550
Ceannate,https://www.crunchbase.com/organization/ceannate,"Rolling Meadows, Illinois, United States",http://www.ceannate.com,
Dale Carnegie Training,https://www.crunchbase.com/organization/dale-carnegie-training,"New York, New York, United States",http://www.dalecarnegie.com,http://www.linkedin.com/company/dale-carnegie-training
UC CEIN,https://www.crunchbase.com/organization/uc-cein,"Los Angeles, California, United States",http://www.cein.ucla.edu/new/,
Cambium Learning Group,https://www.crunchbase.com/organization/cambium-learning-group,"Dallas, Texas, United States",http://cambiumlearning.com,http://www.linkedin.com/company/cambium-learning-group
Lakeshore Learning,https://www.crunchbase.com/organization/lakeshore-learning,"Carson, California, United States",http://www.lakeshorelearning.com/,
Shelby County Schools,https://www.crunchbase.com/organization/shelby-county-schools,"Memphis, Tennessee, United States",http://www.scsk12.org,
School Specialty,https://www.crunchbase.com/organization/school-specialty,"Greenville, Wisconsin, United States",http://www.schoolspecialty.com,http://www.linkedin.com/company/school-specialty-inc.
Helix Education,https://www.crunchbase.com/organization/helix-education,"Salt Lake City, Utah, United States",http://www.helixeducation.com,http://www.linkedin.com/company/3609946
NIST,https://www.crunchbase.com/organization/nist,"Gaithersburg, Maryland, United States",http://www.nist.gov/,http://www.linkedin.com/company/nist
DECA,https://www.crunchbase.com/organization/deca-tv,"Santa Monica, California, United States",http://deca.tv,
Upromise,https://www.crunchbase.com/organization/upromise,"Newton, Massachusetts, United States",http://www.upromise.com/welcome,http://www.linkedin.com/company/upromise
PlayCore,https://www.crunchbase.com/organization/playcore,"Chattanooga, Tennessee, United States",http://www.playcore.com/,http://www.linkedin.com/company/playcore
Annie E. Casey Foundation,https://www.crunchbase.com/organization/annie-e-casey-foundation,"Baltimore, Maryland, United States",http://www.aecf.org/,https://www.linkedin.com/company/annie-e.-casey-foundation
bigchalk.com,https://www.crunchbase.com/organization/bigchalk-com,"Ann Arbor, Michigan, United States",http://www.bigchalk.com,https://www.linkedin.com/company/proquest
Capella Education Company,https://www.crunchbase.com/organization/capella-education-company,"Minneapolis, Minnesota, United States",http://www.capellaeducation.com,http://www.linkedin.com/company/capella-education-company
The Judge Group Inc.,https://www.crunchbase.com/organization/the-judge-group-inc,"Bala Cynwyd, Pennsylvania, United States",http://www.judge.com/twitterlist_main.aspx,http://www.linkedin.com/company/the-judge-group?goback=.cps_1259681693551_1
California Academy of Sciences,https://www.crunchbase.com/organization/california-academy-of-sciences,"San Francisco, California, United States",http://www.calacademy.org,https://www.linkedin.com/company/20513
TripSpark,https://www.crunchbase.com/organization/tripspark,"Cleveland, Ohio, United States",http://www.tripspark.com,https://www.linkedin.com/company/tripspark
VTech,https://www.crunchbase.com/organization/vtech,"Beaverton, Oregon, United States",https://www.vtech.com/,http://www.linkedin.com/company/vtech
Room to Read,https://www.crunchbase.com/organization/room-to-read,"San Francisco, California, United States",http://www.roomtoread.org/,https://www.linkedin.com/company/room-to-read
Bisk,https://www.crunchbase.com/organization/bisk-education,"Tampa, Florida, United States",http://bisk.com/,http://lnked.in/Bisk
Fuel Education,https://www.crunchbase.com/organization/fuel-education,"Herndon, Virginia, United States",https://www.fueleducation.com/,https://in.linkedin.com/company/fuel-education-llc
Next College Student Athlete,https://www.crunchbase.com/organization/next-college-student-athlete,"Chicago, Illinois, United States",http://www.ncsasports.org,https://www.linkedin.com/company/ncsa-athletic-recruiting/
Learning Ally,https://www.crunchbase.com/organization/learning-ally,"Princeton, New Jersey, United States",https://www.learningally.org/,http://www.linkedin.com/groups?home=&gid=2644842&trk=anet_ug_hm
Hachette Book Group,https://www.crunchbase.com/organization/hachette-book-group,"New York, New York, United States",http://www.hachettebookgroup.com,https://www.linkedin.com/company/hachette-book-group
Career Education Corporation,https://www.crunchbase.com/organization/career-education-corporation,"Hoffman Estates, Illinois, United States",http://www.careered.com,http://www.linkedin.com/company/4963
CompassLearning,https://www.crunchbase.com/organization/compasslearning,"Austin, Texas, United States",http://www.compasslearning.com,https://www.linkedin.com/company/edgenuity-inc-
Southwest Foodservice Excellence,https://www.crunchbase.com/organization/southwest-foodservice-excellence,"Scottsdale, Arizona, United States",https://www.sfellc.org,
National Audubon Society (USA),https://www.crunchbase.com/organization/national-audubon-society-usa,"New York, New York, United States",http://www.audubon.org,http://www.linkedin.com/company/national-audubon-society
California Science Center,https://www.crunchbase.com/organization/california-science-center,"Los Angeles, California, United States",http://californiasciencecenter.org/,https://www.linkedin.com/company/california-science-center
EdAssist,https://www.crunchbase.com/organization/edassist,"Watertown, Massachusetts, United States",https://www.edassist.com,https://www.linkedin.com/company/edassist
Barbri Bar Review,https://www.crunchbase.com/organization/barbri-bar-review,"Dallas, Texas, United States",http://www.barbri.com,https://www.linkedin.com/company/barbri-inc-
Cadence Education,https://www.crunchbase.com/organization/cadence-education,"Scottsdale, Arizona, United States",http://www.cadence-education.com/,
Trovix,https://www.crunchbase.com/organization/trovix,"Mountain View, California, United States",http://www.trovix.com,
Thunderbird School of Global Management,https://www.crunchbase.com/organization/thunderbird-school-of-global-management,"Glendale, Arizona, United States",http://www.thunderbird.edu/,http://www.linkedin.com/company/7598
Digital Divide Data,https://www.crunchbase.com/organization/digital-divide-data,"New York, New York, United States",http://www.digitaldividedata.com/,https://www.linkedin.com/company/37426
The Learning ExperienceAcademy,https://www.crunchbase.com/organization/the-learning-experienceacademy-of-early-education,"Harrisburg, Pennsylvania, United States",http://www.thelearningexperience.com,http://www.linkedin.com/company/the-learning-experience
Strayer Education Inc,https://www.crunchbase.com/organization/strayer-education-inc,"Herndon, Virginia, United States",http://www.strayereducation.com/index.cfm,
eCollege,https://www.crunchbase.com/organization/ecollege,"Centennial, Colorado, United States",http://www.ecollege.com,http://www.linkedin.com/company/9817
VetCor,https://www.crunchbase.com/organization/vetcor,"Hingham, Massachusetts, United States",http://www.vetcor.com,https://www.linkedin.com/company/vetcor
Measured Progress,https://www.crunchbase.com/organization/measured-progress,"Dover, New Hampshire, United States",http://www.measuredprogress.org,http://www.linkedin.com/company/measured-progress
EmbanetCompass,https://www.crunchbase.com/organization/embanetcompass,"Elk Grove Village, Illinois, United States",http://embanetcompass.com,https://www.linkedin.com/company/2137
ResCare,https://www.crunchbase.com/organization/rescare,"Louisville, Kentucky, United States",http://www.rescare.com/,
The Sacramento Bee,https://www.crunchbase.com/organization/the-sacramento-bee,"Sacramento, California, United States",http://www.sacbee.com/,http://www.linkedin.com/company/the-sacramento-bee
License Buddy,https://www.crunchbase.com/organization/license-buddy,"San Francisco, California, United States",http://www.licensebuddy.co,
Embanet,https://www.crunchbase.com/organization/embanet,"Elk Grove Village, Illinois, United States",http://www.embanet.com,http://www.linkedin.com/company/34822
Carson-Dellosa,https://www.crunchbase.com/organization/carson-dellosa,"Greensboro, North Carolina, United States",http://www.carsondellosa.com/,
US Anesthesia Partners,https://www.crunchbase.com/organization/us-anesthesia-partners,"Fort Lauderdale, Florida, United States",http://www.usap.com,
High Museum of Art,https://www.crunchbase.com/organization/high-museum-of-art,"Atlanta, Georgia, United States",http://www.high.org/,https://www.linkedin.com/company/high-museum-of-art
ACADEMI,https://www.crunchbase.com/organization/academi,"Reston, Virginia, United States",http://www.academi.com,https://www.linkedin.com/company/academi
Xplor,https://www.crunchbase.com/organization/xplor,"Arlington, Texas, United States",http://www.xplortoday.com/,
Johns Hopkins Applied Physics Lab,https://www.crunchbase.com/organization/johns-hopkins-applied-physics-lab,"Laurel, Maryland, United States",http://jhuapl.edu/,https://www.linkedin.com/company/7251
Merit Energy Company,https://www.crunchbase.com/organization/merit-energy-company,"Dallas, Texas, United States",http://www.meritenergy.com,
Triumvirate Environmental,https://www.crunchbase.com/organization/triumvirate-environmental,"Somerville, Massachusetts, United States",http://www.triumvirate.com,
American Library Association,https://www.crunchbase.com/organization/american-library-association,"Chicago, Illinois, United States",http://www.ala.org,http://www.linkedin.com/company/american-library-association
Data & Marketing Association,https://www.crunchbase.com/organization/direct-marketing-association,"New York, New York, United States",http://thedma.org/,http://www.linkedin.com/company/dma
American Council on Education,https://www.crunchbase.com/organization/american-council-on-education,"Washington, District of Columbia, United States",http://www.acenet.edu/,http://www.linkedin.com/company/american-council-on-education
National University System,https://www.crunchbase.com/organization/national-university-system,"La Jolla, California, United States",https://www.nusystem.org/,https://www.linkedin.com/company/national-university-system/
Translational Genomics Research Institute (TGen),https://www.crunchbase.com/organization/translational-genomics-research-institute-tgen,"Phoenix, Arizona, United States",https://www.tgen.org/,https://www.linkedin.com/company/tgen
Duke Clinical Research institute,https://www.crunchbase.com/organization/duke-clinical-research-institute,"Durham, North Carolina, United States",http://dcri.org,https://www.linkedin.com/company/duke-clinical-research-institute
Becker Professional Education,https://www.crunchbase.com/organization/becker-professional-education,"Downers Grove, Illinois, United States",http://www.becker.com/,
Novitex,https://www.crunchbase.com/organization/novitex,"Stamford, Connecticut, United States",https://www.novitex.com/industries/insurance,https://www.linkedin.com/company/novitex-business-solutions/
San Francisco Unified School District,https://www.crunchbase.com/organization/san-francisco-unified-school-district,"San Francisco, California, United States",http://sfusd.edu/,https://www.linkedin.com/company/san-francisco-unified-school-district
Kennedy Krieger Institute,https://www.crunchbase.com/organization/kennedy-krieger-institute,"Baltimore, Maryland, United States",http://kennedykrieger.org/,https://www.linkedin.com/company/19385?trk=tyah&trkInfo=idx%3A2-1-2%2CtarId%3A1425393560349%2Ctas%3A+Kennedy+Krieger+Institute
Sony DADC,https://www.crunchbase.com/organization/sony-dadc,"Terre Haute, Indiana, United States",http://www.sonydadc.com/en,
Right At School,https://www.crunchbase.com/organization/right-at-school,"Evanston, Illinois, United States",https://rightatschool.com,https://www.linkedin.com/company-beta/2137709/?lipi=urn%3Ali%3Apage%3Ad_flagship3_profile_view_base%3B1Olk5Qh4SA%2BaXfQ%2F%2B%2BUrhg%3D%3D&licu=urn%3Ali%3Acontrol%3Ad_flagship3_profile_view_base-background_details_company
Verizon Foundation,https://www.crunchbase.com/organization/verizon-foundation,"Basking Ridge, New Jersey, United States",http://www.verizonfoundation.org,https://www.linkedin.com/company/verizon
Edusson,https://www.crunchbase.com/organization/edusson,"Park Ridge, Illinois, United States",https://writers-house.com/,
Pacific Scientific Energetic Materials,https://www.crunchbase.com/organization/pacific-scientific-energetic-materials,"Chandler, Arizona, United States",https://psemc.com/,https://www.linkedin.com/company/pacific-scientific
Smarthinking Online Tutoring,https://www.crunchbase.com/organization/smarthinking,"Washington, District of Columbia, United States",http://www.smarthinking.com,http://www.linkedin.com/company/smarthinking-inc.
FHI 360,https://www.crunchbase.com/organization/fhi-360,"Durham, North Carolina, United States",http://www.fhi360.org,http://www.linkedin.com/company/fhi-360
American Management Association,https://www.crunchbase.com/organization/american-management-association,"New York, New York, United States",http://www.amanet.org/,https://www.linkedin.com/company/american-management-association
"Child Development Schools, Inc.",https://www.crunchbase.com/organization/child-development-schools-inc,"Columbus, Georgia, United States",http://www.childcarenetwork.com/,https://www.linkedin.com/company/childcare-network-inc/
Nelson Media,https://www.crunchbase.com/organization/nelson-media,"Nashville, Tennessee, United States",http://www.thomasnelson.com,
LifeWay Christian Resources,https://www.crunchbase.com/organization/lifeway-christian-resources,"Nashville, Tennessee, United States",http://www.lifeway.com,https://www.linkedin.com/company-beta/13391
Brainier Solutions,https://www.crunchbase.com/organization/brainier-solutions,"Minneapolis, Minnesota, United States",http://www.brainier.com,https://www.linkedin.com/company/brainier-solutions-inc./
EF Englishtown,https://www.crunchbase.com/organization/englishtown,"Luzerne, Iowa, United States",http://www.englishtown.com,
National Multiple Sclerosis Society (NMSS),https://www.crunchbase.com/organization/national-multiple-sclerosis-society,"Denver, Colorado, United States",http://www.nationalmssociety.org,http://www.linkedin.com/company/national-ms-society
Polsky Center for Entrepreneurship and Innovation,https://www.crunchbase.com/organization/polsky-center-for-entrepreneurship-and-innovation-accelerator-program,"Chicago, Illinois, United States",http://polsky.uchicago.edu/,
Texas Education Agency,https://www.crunchbase.com/organization/texas-education-agency,"Lubbock, Texas, United States",http://tea.texas.gov/,
Nobel Learning,https://www.crunchbase.com/organization/nobel-learning,"West Chester, Pennsylvania, United States",http://www.nobellearning.com/,
Capstone Publishing,https://www.crunchbase.com/organization/capstone-publishing,"Mankato, Minnesota, United States",http://www.capstonepub.com,
Connections Education,https://www.crunchbase.com/organization/connections-education-2,"Baltimore, Maryland, United States",http://www.connectionseducation.com/,
Education Corporation of America,https://www.crunchbase.com/organization/education-corporation-of-america-inc,"Birmingham, Alabama, United States",https://www.ecacolleges.com,
Campus Consortium,https://www.crunchbase.com/organization/campusconsortium,"Chicago, Illinois, United States",http://www.campusconsortium.org,https://www.linkedin.com/company/40358/
Clute Institute,https://www.crunchbase.com/organization/clute-institute,"Littleton, Colorado, United States",http://www.cluteinstitute.com/,https://www.linkedin.com/company/the-clute-institute
Compassion International,https://www.crunchbase.com/organization/compassion-international,"Colorado Springs, Colorado, United States",http://www.compassion.com/,
Rainbow Child Care Center,https://www.crunchbase.com/organization/rainbow-child-care-center,"Troy, Michigan, United States",http://www.rainbowccc.com/,https://www.linkedin.com/company/rainbow-child-care-centers
Unitek,https://www.crunchbase.com/organization/unitek,"Fremont, California, United States",http://www.unitek.com,
Georgia Department of Education,https://www.crunchbase.com/organization/georgia-department-of-education,"Atlanta, Georgia, United States",http://www.gadoe.org,
American Public Education,https://www.crunchbase.com/organization/american-public-education,"Charles Town, West Virginia, United States",http://www.americanpubliceducation.com,
Exploratorium,https://www.crunchbase.com/organization/exploratorium,"San Francisco, California, United States",http://www.exploratorium.edu,http://www.linkedin.com/company/exploratorium
Monstertrak,https://www.crunchbase.com/organization/monstertrak-com,"San Francisco, California, United States",http://www.monstertrak.com,
PetroSkills,https://www.crunchbase.com/organization/petroskills,"Tulsa, Oklahoma, United States",http://www.petroskills.com,
Merrill Edge,https://www.crunchbase.com/organization/merrill-edge,"Chicago, Illinois, United States",http://www.merrilledge.com,https://www.linkedin.com/company/merrill-edge
Educator,https://www.crunchbase.com/organization/educator,"Los Angeles, California, United States",http://www.educator.com,
Virtual Nerd,https://www.crunchbase.com/organization/virtual-nerd,"St Louis, Missouri, United States",http://www.virtualnerd.com,
authorGEN,https://www.crunchbase.com/organization/authorgen,"Fairbanks, Alaska, United States",http://www.authorgen.com,
globalscholar.com,https://www.crunchbase.com/organization/globalscholar-com,"Bellevue, Washington, United States",http://www.globalscholar.com,
Arbor Day Foundation,https://www.crunchbase.com/organization/arbor-day-foundation,"Nebraska City, Nebraska, United States",http://arborday.org,https://www.linkedin.com/company/arbor-day-foundation
Brightside Academy,https://www.crunchbase.com/organization/brightside-academy,"Pittsburgh, Pennsylvania, United States",http://www.brightsideacademy.com/,
Source4Teachers,https://www.crunchbase.com/organization/source4teachers,"Cherry Hill, New Jersey, United States",https://www.source4teachers.com/,https://www.linkedin.com/company/903710?trk=tyah
Lahey Clinic,https://www.crunchbase.com/organization/lahey-clinic,"Burlington, Massachusetts, United States",http://www.lahey.org,
Nebraska Medicine,https://www.crunchbase.com/organization/nebraska-medicine,"Omaha, Nebraska, United States",https://www.nebraskamed.com,
Nurtur Health,https://www.crunchbase.com/organization/nurtur-health,"Dallas, Texas, United States",http://www.nurturhealth.com/index.html,http://www.linkedin.com/company/1454592
Achieve Beyond,https://www.crunchbase.com/organization/achieve-beyond,"Forest Hills, New York, United States",http://www.achievebeyondusa.com,http://www.linkedin.com/company/achieve-beyond
Practicing Law Institute,https://www.crunchbase.com/organization/practicing-law-institute,"New York, New York, United States",https://pli.edu,
Juma Ventures,https://www.crunchbase.com/organization/juma-ventures,"San Francisco, California, United States",http://www.juma.org/,https://www.linkedin.com/company/42607
Drug Information Association,https://www.crunchbase.com/organization/drug-information-association,"Horsham, Pennsylvania, United States",http://www.diahome.org/en-US.aspx,https://www.linkedin.com/company-beta/384676/?pathWildcard=384676
Pump It Up,https://www.crunchbase.com/organization/pump-it-up-and-bounceu,"Scottsdale, Arizona, United States",https://www.pumpitupparty.com,https://www.linkedin.com/company/pump-it-up
OKS Group,https://www.crunchbase.com/organization/oks-group,"Bala Cynwyd, Pennsylvania, United States",http://www.oksgroup.com,https://www.linkedin.com/company/oks-group
SFMOMA,https://www.crunchbase.com/organization/sfmoma,"San Francisco, California, United States",http://www.sfmoma.org,https://www.linkedin.com/company-beta/165835/
Intrax,https://www.crunchbase.com/organization/intrax,"San Francisco, California, United States",https://www.intraxinc.com/,https://www.linkedin.com/company/intrax/
Harvard Innovation Labs,https://www.crunchbase.com/organization/harvard-ilab,"Boston, Massachusetts, United States",http://i-lab.harvard.edu/,http://www.linkedin.com/company/3290938
Education Connection,https://www.crunchbase.com/organization/education-connection,"Boca Raton, Florida, United States",http://www.educationconnection.com,
EdisonLearning,https://www.crunchbase.com/organization/edisonlearning,"Jersey City, New Jersey, United States",http://www.edisonlearning.com,
Bradford Child Care Services,https://www.crunchbase.com/organization/bradford-child-care-services,"Bridgeville, Pennsylvania, United States",http://www.earlyeducationpros.org,
"City Year, Inc",https://www.crunchbase.com/organization/city-year-inc,"Boston, Massachusetts, United States",https://www.cityyear.org,https://www.linkedin.com/company/city-year
Ntech Industries,https://www.crunchbase.com/organization/ntech-industries,"Ukiah, California, United States",http://www.ntechindustries.com,https://www.linkedin.com/company/trimble-agriculture
LakeView Technology,https://www.crunchbase.com/organization/lakeview-technology-inc,"Oak Brook, Illinois, United States",http://www.lakeviewtech.com,https://www.linkedin.com/company/vision-solutions
Texas Children's Hospital,https://www.crunchbase.com/organization/texas-children-s-hospital,"Houston, Texas, United States",http://texaschildrenspeople.org/,https://www.linkedin.com/company/texas-children's-hospital
Paradigm Learning,https://www.crunchbase.com/organization/paradigm-learning,"St. Petersburg, Florida, United States",http://www.paradigmlearning.com,http://www.linkedin.com/company/paradigm-learning
Kaplan Early Learning Group,https://www.crunchbase.com/organization/kaplan-early-learning-group,"Lewisville, North Carolina, United States",https://www.kaplanco.com,https://www.linkedin.com/company/kaplan-early-learning-company
Alleyoop,https://www.crunchbase.com/organization/alleyoop,"Boston, Massachusetts, United States",http://www.alleyoop.com,https://www.linkedin.com/company/2137
Highlights for Children,https://www.crunchbase.com/organization/highlights-for-children,"Columbus, Ohio, United States",http://www.highlights.com,https://www.linkedin.com/company/highlights-for-children
LEARN Behavioral,https://www.crunchbase.com/organization/learn-behavioral,"Baltimore, Maryland, United States",https://www.learnbehavioral.com/,https://www.linkedin.com/company/learnbehavioral/
VALIC,https://www.crunchbase.com/organization/valic,"Amarillo, Texas, United States",http://www.valic.com/,https://www.linkedin.com/company/valic
