Organization Name,Organization Name URL,Headquarters Location,Website,LinkedIn
Trilogy Education Services,https://www.crunchbase.com/organization/trilogy-education-services,"New York, New York, United States",http://www.trilogyed.com,https://www.linkedin.com/company-beta/10164760/
Johns Hopkins University,https://www.crunchbase.com/organization/johns-hopkins-university,"Baltimore, Maryland, United States",http://www.jhu.edu/,http://www.linkedin.com/company/johns-hopkins-university
Cornerstone OnDemand,https://www.crunchbase.com/organization/cornerstone-ondemand,"Santa Monica, California, United States",http://www.cornerstoneondemand.com,http://www.linkedin.com/company/cornerstone-ondemand
News Corp.,https://www.crunchbase.com/organization/newscorporation,"New York, New York, United States",http://www.newscorp.com/,https://www.linkedin.com/company/newscorp
Houghton Mifflin Harcourt,https://www.crunchbase.com/organization/houghton-mifflin-harcourt,"Boston, Massachusetts, United States",http://www.hmhco.com,http://www.linkedin.com/company/houghton-mifflin-harcourt
Dude Solutions,https://www.crunchbase.com/organization/dude-solutions,"Cary, North Carolina, United States",http://dudesolutions.com,https://www.linkedin.com/company/dude-solutions
University of Texas at Austin,https://www.crunchbase.com/organization/university-of-texas-at-austin,"Austin, Texas, United States",http://www.utexas.edu,https://in.linkedin.com/edu/the-university-of-texas-at-austin-19518
2U Inc.,https://www.crunchbase.com/organization/2u,"Hyattsville, Maryland, United States",http://2u.com,https://www.linkedin.com/company/2u
Kaltura,https://www.crunchbase.com/organization/kaltura,"New York, New York, United States",http://corp.kaltura.com,http://www.linkedin.com/company/kaltura
Chegg,https://www.crunchbase.com/organization/chegg,"Santa Clara, California, United States",http://www.chegg.com,https://www.linkedin.com/company/137338
"University of California, San Francisco",https://www.crunchbase.com/organization/university-of-california-san-francisco,"San Francisco, California, United States",http://www.ucsf.edu,https://www.linkedin.com/company/ucsf
General Assembly,https://www.crunchbase.com/organization/general-assembly,"New York, New York, United States",https://generalassemb.ly/,https://www.linkedin.com/school/general-assemb-ly/
Change Healthcare,https://www.crunchbase.com/organization/change-healthcare,"Brentwood, Tennessee, United States",http://www.changehealthcare.com,http://www.linkedin.com/company/change-healthcare
Pluralsight,https://www.crunchbase.com/organization/pluralsight,"Farmington, Utah, United States",http://www.pluralsight.com,http://www.linkedin.com/company/pluralsight
GLG (Gerson Lehrman Group),https://www.crunchbase.com/organization/gerson-lehrman-group,"New York, New York, United States",http://GLG.it,https://www.linkedin.com/company/163983
Lynda,https://www.crunchbase.com/organization/lynda-com,"Carpinteria, California, United States",http://www.lynda.com,https://www.linkedin.com/company/lynda.com
Quad/Graphics,https://www.crunchbase.com/organization/quad-graphics,"Sussex, Wisconsin, United States",http://www.qg.com/,http://in.linkedin.com/company/quadgraphics
Age of Learning,https://www.crunchbase.com/organization/age-of-learning,"Glendale, California, United States",http://www.ageoflearning.com,http://www.linkedin.com/company/age-of-learning-inc.
Simplilearn,https://www.crunchbase.com/organization/simplilearn,"San Francisco, California, United States",http://www.simplilearn.com,http://www.linkedin.com/company/simplilearn
Renaissance Learning,https://www.crunchbase.com/organization/renaissance-learning,"Wisconsin Rapids, Wisconsin, United States",http://www.renaissance.com,http://www.linkedin.com/company/renaissance-learning
California State University,https://www.crunchbase.com/organization/california-state-university,"Long Beach, California, United States",http://www.calstate.edu/,https://www.linkedin.com/company/binance-helpdesk
SunGard,https://www.crunchbase.com/organization/sungard,"Wayne, Pennsylvania, United States",http://www.sungard.com,https://www.linkedin.com/company/sungard
Open English,https://www.crunchbase.com/organization/open-english,"Miami, Florida, United States",http://www.openenglish.com,https://www.linkedin.com/company/open-english
Freedom Financial Network,https://www.crunchbase.com/organization/freedom-financial-network,"San Mateo, California, United States",http://freedomfinancialnetwork.com,https://www.linkedin.com/company/freedom-financial/
InstaEDU,https://www.crunchbase.com/organization/instaedu,"San Francisco, California, United States",http://instaedu.com,
Craftsy,https://www.crunchbase.com/organization/sympoz,"Denver, Colorado, United States",http://www.craftsy.com,http://www.linkedin.com/company/craftsy
Edmentum,https://www.crunchbase.com/organization/edmentum,"Bloomington, Minnesota, United States",http://www.edmentum.com,http://www.linkedin.com/company/edmentum
JumpStart,https://www.crunchbase.com/organization/jumpstart-2,"Torrance, California, United States",http://www.jumpstart.com,
"Laureate Education, Inc.",https://www.crunchbase.com/organization/laureate-education,"Baltimore, Maryland, United States",http://www.laureate.net,http://www.linkedin.com/company/laureate-international-universities
LabCorp,https://www.crunchbase.com/organization/laboratory-corporation-of-america,"Burlington, North Carolina, United States",https://www.labcorp.com,https://www.linkedin.com/company/labcorp
Teach for America,https://www.crunchbase.com/organization/teach-for-america,"New York, New York, United States",http://www.teachforamerica.org/,http://www.linkedin.com/company/teach-for-america
Instructure,https://www.crunchbase.com/organization/instructure,"Salt Lake City, Utah, United States",http://www.instructure.com,https://www.linkedin.com/company/instructure-inc-
Cengage Learning,https://www.crunchbase.com/organization/cengage-learning,"Stamford, Connecticut, United States",http://www.cengage.com/us,https://www.linkedin.com/company/cengage-learning
Cramster,https://www.crunchbase.com/organization/cramster,"Pasadena, California, United States",http://www.Cramster.com,
Penn Medicine,https://www.crunchbase.com/organization/penn-medicine,"Philadelphia, Pennsylvania, United States",http://pennmedicine.org,http://www.linkedin.com/company/university-of-pennsylvania-health-system
Maximus,https://www.crunchbase.com/organization/maximus,"Reston, Virginia, United States",http://www.maximus.com/,http://www.linkedin.com/company/164881
Success Academy Charter Schools,https://www.crunchbase.com/organization/success-academy-charter-schools,"New York, New York, United States",http://successacademies.org,http://www.linkedin.com/company/success-academy-charter-schools
Rocketship Education,https://www.crunchbase.com/organization/rocketship-education,"Redwood City, California, United States",http://rsed.org,https://www.linkedin.com/company/361369
BetterUp,https://www.crunchbase.com/organization/betterup,"San Francisco, California, United States",http://www.betterup.co/,https://www.linkedin.com/company/betterup
HealthStream,https://www.crunchbase.com/organization/healthstream,"Nashville, Tennessee, United States",http://www.healthstream.com,http://www.linkedin.com/company/healthstream
NWEA,https://www.crunchbase.com/organization/nwea,"Portland, Oregon, United States",https://www.nwea.org/,https://www.linkedin.com/company/nwea/
Dana-Farber Cancer Institute,https://www.crunchbase.com/organization/dana-farber-cancer-institute,"Boston, Massachusetts, United States",http://www.dana-farber.org,http://www.linkedin.com/company/dana-farber-cancer-institute
Engility,https://www.crunchbase.com/organization/engility,"Chantilly, Virginia, United States",http://www.engilitycorp.com,http://www.linkedin.com/company/engility-corporation
American Institutes for Research (AIR),https://www.crunchbase.com/organization/american-institutes-for-research,"Washington, District of Columbia, United States",http://www.air.org/,https://www.linkedin.com/company/6904
Promethean,https://www.crunchbase.com/organization/promethean-2,"Alpharetta, Georgia, United States",http://www.prometheanworld.com,https://www.linkedin.com/company-beta/201287/
Kno,https://www.crunchbase.com/organization/kno,"Santa Clara, California, United States",http://kno.com,
HarperCollins,https://www.crunchbase.com/organization/harpercollins,"New York, New York, United States",http://www.harpercollins.com,http://www.linkedin.com/company/164124
Zovio,https://www.crunchbase.com/organization/bridgepoint-education,"San Diego, California, United States",http://zovio.com/,https://www.linkedin.com/company/zovio/
Learn It Systems,https://www.crunchbase.com/organization/learn-it-systems,"Baltimore, Maryland, United States",http://learnitsystems.com,https://www.linkedin.com/company/learn-it-systems
Rosetta Stone,https://www.crunchbase.com/organization/rosetta-stone,"Arlington, Virginia, United States",http://www.rosettastone.com,https://www.linkedin.com/company/rosettastone
Archipelago Learning,https://www.crunchbase.com/organization/study-island,"Dallas, Texas, United States",http://www.archipelagolearning.com,http://www.linkedin.com/company/538161
Wyss Institute,https://www.crunchbase.com/organization/wyss-institute,"Boston, Massachusetts, United States",http://wyss.harvard.edu,http://www.linkedin.com/company/wyss-institute-for-biologically-inspired-engineering
Institute of Electrical & Electronics Engineers,https://www.crunchbase.com/organization/ieee,"New York, New York, United States",http://ieee.org,https://www.linkedin.com/company/ieee
Questar Assessment,https://www.crunchbase.com/organization/questar-assessment-inc,"Brewster, New York, United States",http://www.questarai.com,https://www.linkedin.com/company/questar-assessment-inc-
School of Rock,https://www.crunchbase.com/organization/school-of-rock,"Willowbrook, Illinois, United States",http://www.schoolofrock.com,
Adtalem Global Education,https://www.crunchbase.com/organization/devry-education-group,"Downers Grove, Illinois, United States",https://www.adtalem.com/,
American Medical Association,https://www.crunchbase.com/organization/american-medical-association,"Chicago, Illinois, United States",http://ama-assn.org,http://www.linkedin.com/company/american-medical-association
Wireless Generation,https://www.crunchbase.com/organization/wireless-generation,"Brooklyn, New York, United States",http://www.wgen.net,
Everest Education,https://www.crunchbase.com/organization/everest-education,"Santa Ana, California, United States",https://e2.com.vn/,https://www.linkedin.com/company/everest-education
K12,https://www.crunchbase.com/organization/k12,"Herndon, Virginia, United States",http://www.k12.com,http://www.linkedin.com/company/164570
Allergan,https://www.crunchbase.com/organization/allergan,"Parsippany, New Jersey, United States",http://www.allergan.com,https://www.linkedin.com/company/allergan
SeaWorld Parks & Entertainment,https://www.crunchbase.com/organization/seaworld-parks-entertainment,"Orlando, Florida, United States",http://seaworldentertainment.com,http://www.linkedin.com/company/seaworld-parks-&-entertainment
Enclara Pharmacia,https://www.crunchbase.com/organization/enclara-health,"Philadelphia, Pennsylvania, United States",http://www.enclarapharmacia.com/,https://www.linkedin.com/company/enclara-pharmacia
WestEd,https://www.crunchbase.com/organization/wested,"San Francisco, California, United States",http://www.wested.org/,http://www.linkedin.com/company/wested
Blackboard,https://www.crunchbase.com/organization/blackboard,"Washington, District of Columbia, United States",http://www.blackboard.com,http://www.linkedin.com/company/blackboard
"John Wiley & Sons, Inc",https://www.crunchbase.com/organization/wiley,"Hoboken, New Jersey, United States",http://wiley.com,https://www.linkedin.com/company/2239210
Austin Independent School District,https://www.crunchbase.com/organization/austin-independent-school-district,"Austin, Texas, United States",https://www.austinisd.org/,https://www.linkedin.com/company/6758/
ADvTECH,https://www.crunchbase.com/organization/advtech,"Sandston, Virginia, United States",http://advtech.co.za,https://www.linkedin.com/company/advtech
Kaplan,https://www.crunchbase.com/organization/kaplan,"Fort Lauderdale, Florida, United States",http://www.kaplan.com,http://www.linkedin.com/company/kaplan
Optum,https://www.crunchbase.com/organization/optum,"Eden Prairie, Minnesota, United States",https://www.optum.com,http://www.linkedin.com/company/optum
BUILD,https://www.crunchbase.com/organization/build,"Redwood City, California, United States",http://build.org,https://www.linkedin.com/company/513390
Fisher-Price,https://www.crunchbase.com/organization/fisher-price,"East Aurora, New York, United States",http://www.fisher-price.com,http://www.linkedin.com/company/fisher-price
Ellucian,https://www.crunchbase.com/organization/ellucian,"Fairfax, Virginia, United States",http://www.ellucian.com/,http://www.linkedin.com/company/2536305
Education Development Center (EDC),https://www.crunchbase.com/organization/edc,"Newton, Massachusetts, United States",http://www.edc.org,http://www.linkedin.com/company/education-development-center
TTi Global,https://www.crunchbase.com/organization/tti-global,"Rochester Hills, Michigan, United States",http://www.tti-global.com/,
Acelero Learning,https://www.crunchbase.com/organization/acelero-learning,"New York, New York, United States",http://www.acelero.net/,https://www.linkedin.com/company/acelero-learning?trk=hb_tab_compy_id_957210
Investools,https://www.crunchbase.com/organization/investools,"Draper, Utah, United States",https://www.investools.com,https://www.linkedin.com/company/investools
Eleutian Technology,https://www.crunchbase.com/organization/eleutian-technology,"Ten Sleep, Wyoming, United States",http://www.eleutian.com,https://www.linkedin.com/company/eleutian-technology
NC State-Wilson College of Textiles,https://www.crunchbase.com/organization/nc-state-wilson-college-of-textiles,"Raleigh, North Carolina, United States",https://textiles.ncsu.edu/,https://www.linkedin.com/company/nc-state-wilson-college-of-textiles/
NeXT,https://www.crunchbase.com/organization/next,"Redwood City, California, United States",http://next.com,https://www.linkedin.com/company/apple
Woods Hole Oceanographic Institute,https://www.crunchbase.com/organization/woods-hole-oceanographic-institute,"Woods Hole, Massachusetts, United States",http://www.whoi.edu,https://www.linkedin.com/company/woods-hole-oceanographic-institution
Museum of Science,https://www.crunchbase.com/organization/museum-of-science,"Boston, Massachusetts, United States",http://www.mos.org,http://www.linkedin.com/company/boston-museum-of-science
IDEA Public Schools Enterprises,https://www.crunchbase.com/organization/idea-public-schools-enterprises,"Weslaco, Texas, United States",https://www.ideapublicschools.org/,https://www.linkedin.com/company/idea-public-schools/
PowerSchool,https://www.crunchbase.com/organization/powerschool,"Folsom, California, United States",http://www.powerschool.com/,https://www.linkedin.com/company/powerschool
Fight My Monster,https://www.crunchbase.com/organization/fight-my-monster,"San Mateo, California, United States",http://www.FightMyMonster.com,https://www.linkedin.com/company/fight-my-monster-ltd
Follett Corporation,https://www.crunchbase.com/organization/follett-corporation,"Westchester, Illinois, United States",http://www.follett.com,https://www.linkedin.com/company/3830647?trk=vsrp_companies_res_name&trkInfo=VSRPsearchId%3A781305561408377349148%2CVSRPtargetId%3A3830647%2CVSRPcmpt%3Aprimary
Cleveland Metroparks,https://www.crunchbase.com/organization/cleveland-metroparks,"Cleveland, Ohio, United States",https://clevelandmetroparks.com/,https://www.linkedin.com/company/cleveland-metroparks/
MathWorks,https://www.crunchbase.com/organization/mathworks,"Natick, Massachusetts, United States",http://www.mathworks.com,http://www.linkedin.com/company/the-mathworks_2
American Kennel Club,https://www.crunchbase.com/organization/american-kennel-club,"New York, New York, United States",http://www.akc.org/,https://www.linkedin.com/company/american-kennel-club
"University of California, Santa Barbara",https://www.crunchbase.com/organization/university-of-california-santa-barbara,"Santa Barbara, California, United States",http://www.ucsb.edu,https://www.linkedin.com/edu/school?id=17959
EdCaliber,https://www.crunchbase.com/organization/edcaliber,"Portland, Oregon, United States",http://edcaliber.com,http://www.linkedin.com/company/3312336
Scholastic,https://www.crunchbase.com/organization/scholastic,"New York, New York, United States",http://www.scholastic.com,
Brooklyn Public Library,https://www.crunchbase.com/organization/brooklyn-public-library,"Brooklyn, Iowa, United States",https://www.bklynlibrary.org/,https://www.linkedin.com/company/brooklyn-public-library
HighBeam Research,https://www.crunchbase.com/organization/highbeam-research,"Chicago, Illinois, United States",http://www.highbeam.com,
Mimeo,https://www.crunchbase.com/organization/mimeo,"New York, New York, United States",http://www.mimeo.com,http://www.linkedin.com/company/mimeo.com
Presidium Learning,https://www.crunchbase.com/organization/presidium-learning,"Reston, Virginia, United States",http://www.presidiuminc.com,
BioMARC,https://www.crunchbase.com/organization/biomarc,"Fort Collins, Colorado, United States",http://biomarc.colostate.edu,http://www.linkedin.com/groups?gid=6614458
American Psychological Association,https://www.crunchbase.com/organization/american-psychological-association,"Washington, District of Columbia, United States",http://apa.org/,http://www.linkedin.com/company/american-psychological-association
ProctorU,https://www.crunchbase.com/organization/proctoru,"Hoover, Alabama, United States",http://www.proctoru.com,
"Curriculum Associates, Inc.",https://www.crunchbase.com/organization/curriculum-associates-inc,"North Billerica, Massachusetts, United States",http://www.curriculumassociates.com,https://www.linkedin.com/company/curriculum-associates
UAB Comprehensive Cancer Center,https://www.crunchbase.com/organization/uab-comprehensive-cancer-center,"Birmingham, Alabama, United States",http://cancercenter.uab.edu/,
ACT,https://www.crunchbase.com/organization/act,"Iowa City, Iowa, United States",http://www.act.org/aboutact/index.html,http://www.linkedin.com/company/act
Melissa & Doug,https://www.crunchbase.com/organization/melissa-doug,"Wilton, Connecticut, United States",http://www.melissaanddoug.com/,
MIT Energy Initiative,https://www.crunchbase.com/organization/mit-energy-initiative,"Cambridge, Massachusetts, United States",http://mitei.mit.edu,
Relias Learning,https://www.crunchbase.com/organization/relias-learning,"Cary, North Carolina, United States",http://reliaslearning.com,http://www.linkedin.com/company/2738049
Empowered Careers,https://www.crunchbase.com/organization/encore-career-institute,"Campbell, California, United States",http://empoweredu.com,http://www.linkedin.com/company/2549107
Berklee College Of Music,https://www.crunchbase.com/organization/berklee-college-of-music,"Boston, Massachusetts, United States",https://www.berklee.edu,http://www.linkedin.com/edu/berklee-college-of-music-19966
Wolfram Research,https://www.crunchbase.com/organization/wolfram-research,"Champaign, Illinois, United States",http://www.wolfram.com,https://www.linkedin.com/company/wolfram-research
Uplift Education,https://www.crunchbase.com/organization/uplift-education,"Dallas, Texas, United States",http://www.uplifteducation.org,
MIT CSHub,https://www.crunchbase.com/organization/mit-cshub,"Cambridge, Massachusetts, United States",http://cshub.mit.edu,
ABM Industries,https://www.crunchbase.com/organization/abm-industries,"New York, New York, United States",http://abm.com,http://www.linkedin.com/company/abm-industries
Wolfram Alpha,https://www.crunchbase.com/organization/wolfram-alpha,"Champaign, Illinois, United States",http://www.wolframalpha.com,
Florida Virtual School,https://www.crunchbase.com/organization/florida-virtual-school,"Orlando, Florida, United States",https://flvs.net/,https://www.linkedin.com/company/26935
Macmillan Learning,https://www.crunchbase.com/organization/macmillan-learning,"New York, New York, United States",http://www.macmillanlearning.com/,https://www.linkedin.com/company-beta/10374733?pathWildcard=10374733
Ascend Learning,https://www.crunchbase.com/organization/ascend-learning,"Burlington, Massachusetts, United States",http://www.ascendlearning.com,http://www.linkedin.com/company/2155460
Hobsons,https://www.crunchbase.com/organization/hobsons,"Cincinnati, Ohio, United States",http://www.hobsons.com,http://www.linkedin.com/company/hobsons
Peace Corps,https://www.crunchbase.com/organization/peace-corps,"Washington, District of Columbia, United States",http://www.peacecorps.gov,https://www.linkedin.com/company/peace-corps
CEINT,https://www.crunchbase.com/organization/ceint,"Durham, North Carolina, United States",http://ceint.duke.edu,
Job Corps,https://www.crunchbase.com/organization/job-corps,"Washington, District of Columbia, United States",https://www.jobcorps.gov/,
National Education Association,https://www.crunchbase.com/organization/national-education-association,"Washington, District of Columbia, United States",http://www.nea.org,http://www.linkedin.com/company/12400
KinderCare Education,https://www.crunchbase.com/organization/kindercare-education,"Portland, Oregon, United States",http://kc-education.com/,https://www.linkedin.com/company/kindercare
Edgenuity,https://www.crunchbase.com/organization/edgenuity,"Scottsdale, Arizona, United States",http://www.edgenuity.com,https://www.linkedin.com/company/edgenuity-inc-?trk=company_name
Dictionary.com,https://www.crunchbase.com/organization/dictionary-com,"Oakland, California, United States",http://www.dictionary.com,
"SOFIA Labs, LLC",https://www.crunchbase.com/organization/sofia-2,"New York, New York, United States",,
RTI International,https://www.crunchbase.com/organization/research-triangle,"Raleigh, North Carolina, United States",http://www.rti.org,
FrontStream,https://www.crunchbase.com/organization/front-stream-payments,"Reston, Virginia, United States",http://www.frontstream.com,https://www.linkedin.com/company/frontstream
Government Performance Lab-Harvard University,https://www.crunchbase.com/organization/government-performance-lab-harvard-university,"Cambridge, Massachusetts, United States",http://govlab.hks.harvard.edu/,
SterlingBackcheck,https://www.crunchbase.com/organization/sterlingbackcheck,"New York, New York, United States",http://www.sterlingbackcheck.com/,http://www.linkedin.com/company/sterlingbackcheck
Barnes & Noble Education,https://www.crunchbase.com/organization/barnes-noble-education,"Basking Ridge, New Jersey, United States",http://bned.com/,
GALE CENGAGE Learning,https://www.crunchbase.com/organization/gale-cengage-learning,"Farmington Hills, Michigan, United States",http://www.gale.cengage.com,https://www.linkedin.com/showcase/3836963/
Carnegie Mellon CyLab,https://www.crunchbase.com/organization/carnegie-mellon-cylab,"Pittsburgh, Pennsylvania, United States",http://cylab.cmu.edu,https://www.linkedin.com/company/carnegie-mellon-university-cylab
Educational Testing Service (ETS),https://www.crunchbase.com/organization/educational-testing-service-ets,"Princeton, New Jersey, United States",http://www.ets.org,
Navient Corporation,https://www.crunchbase.com/organization/navient-corporation,"Wilmington, Delaware, United States",http://jobs.navient.com/,https://www.linkedin.com/company/navient
CollegeBoard,https://www.crunchbase.com/organization/collegeboard,"New York, New York, United States",http://www.collegeboard.org,http://www.linkedin.com/company/the-college-board
Prometric,https://www.crunchbase.com/organization/prometric,"Baltimore, Maryland, United States",http://www.prometric.com/en-us/Pages/home.aspx,https://www.linkedin.com/company/1146
Sylvan Learning,https://www.crunchbase.com/organization/sylvan-learning-systems,"Hunt Valley, Maryland, United States",http://www.sylvanfranchise.com,https://www.linkedin.com/company/531631/
Higher One,https://www.crunchbase.com/organization/higher-one,"New Haven, Connecticut, United States",http://www.higherone.com,http://www.linkedin.com/company/higher-one
C2 Education,https://www.crunchbase.com/organization/c2-education,"Duluth, Georgia, United States",http://www.c2educate.com,http://www.linkedin.com/company/c2-education
Pittsburgh Center for Kidney Research,https://www.crunchbase.com/organization/pittsburgh-center-for-kidney-research,"Pittsburgh, Pennsylvania, United States",http://www.kidneycenter.pitt.edu,
"Catapult Learning, Inc.",https://www.crunchbase.com/organization/catapult-learning,"Camden, New Jersey, United States",http://www.catapultlearning.com/,https://www.linkedin.com/company/catapult-learning/
Education Dynamics,https://www.crunchbase.com/organization/education-dynamics,"Hoboken, New Jersey, United States",http://www.educationdynamics.com,https://www.linkedin.com/company/educationdynamics
National Technical Institute for the Deaf,https://www.crunchbase.com/organization/national-technical-institute-for-the-deaf,"Rochester, New York, United States",http://www.ntid.rit.edu,
PCM,https://www.crunchbase.com/organization/pcm-3,"El Segundo, California, United States",http://www.pcm.com/,https://www.linkedin.com/company/pcm-inc
Harris School Solutions,https://www.crunchbase.com/organization/harris-school-solutions,"Niagara Falls, New York, United States",http://harrisschoolsolutions.com,https://www.linkedin.com/company/harrisschoolsolutions
Keypath Education,https://www.crunchbase.com/organization/keypath-education,"Lenexa, Kansas, United States",http://www.keypathedu.com/,https://www.linkedin.com/company/keypath-education
